<?xml version="1.0" encoding="UTF-8"?>
<!DOCTYPE com:adressePostale SYSTEM "./commun.dtd">
<com:adressePostale xlmns:com="http://www.univ-amu.fr/XML/commun">
	<com:précision xlmns:com="http://www.univ-amu.fr/XML/commun">2ème étage</com:précision>
	<com:complément xlmns:com="http://www.univ-amu.fr/XML/commun">Bâtiment Austerlitz</com:complément>
	<com:voie xlmns:com="http://www.univ-amu.fr/XML/commun">
		<com:numéroVoie xlmns:com="http://www.univ-amu.fr/XML/commun">15-19</com:numéroVoie>
		<com:typeVoie xlmns:com="http://www.univ-amu.fr/XML/commun" valeur="allée"/>
		<com:nom xlmns:com="http://www.univ-amu.fr/XML/commun">Claude Forbin</com:nom>
	</com:voie>
	<com:localité xlmns:com="http://www.univ-amu.fr/XML/commun">
		<com:codePostal xlmns:com="http://www.univ-amu.fr/XML/commun">13100</com:codePostal>
		<com:commune xlmns:com="http://www.univ-amu.fr/XML/commun">AIX-EN-PROVENCE</com:commune>
	</com:localité>
	<com:pays xlmns:com="http://www.univ-amu.fr/XML/commun">FRANCE</com:pays>
</com:adressePostale>