<?xml version="1.0" encoding="UTF-8"?>
<!DOCTYPE com:coordonnéesComplètes SYSTEM "./commun.dtd">
<com:coordonnéesComplètes xlmns:com="http://www.univ-amu.fr/XML/commun">
	<com:identité>
		<com:dénominationPersonne>
			<com:civilité valeur="M."/>
			<com:prénomUsuel>Philippe</com:prénomUsuel>
			<com:prénomComplémentaire>Claude</com:prénomComplémentaire>
			<com:prénomComplémentaire>Laurent</com:prénomComplémentaire>
			<com:prénomComplémentaire>Gabriel</com:prénomComplémentaire>
			<com:nom>RAMADOUR</com:nom>
		</com:dénominationPersonne>
	</com:identité>
	<com:adressePostale>
		<com:précision>2ème étage</com:précision>
		<com:complément>Bâtiment Austerlitz</com:complément>
		<com:voie>
			<com:numéroVoie>15-19</com:numéroVoie>
			<com:typeVoie valeur="allée"/>
			<com:nom>Claude Forbin</com:nom>
		</com:voie>
		<com:localité>
			<com:codePostal>13100</com:codePostal>
			<com:commune>AIX-EN-PROVENCE</com:commune>
		</com:localité>
		<com:pays>FRANCE</com:pays>
	</com:adressePostale>
	<com:numTéléphone>01.01.01.01.01</com:numTéléphone>
	<com:numTéléphone>01.01.01.01.02</com:numTéléphone>
	<com:numFax>02.02.02.02.01</com:numFax>
	<com:numFax>02.02.02.02.02</com:numFax>
	<com:adresseMél>philippe.ramadour@univ-amu.fr</com:adresseMél>
</com:coordonnéesComplètes>